kernel_gen/kernel_gen/configs/triton_matmul_autotune_gfx1101.json
{
  "matmul": {
    "gfx1101": {
      "addmm_bf16": {
        "BLOCK_SIZE_M": 128,
        "BLOCK_SIZE_N": 64,
        "BLOCK_SIZE_K": 64,
        "GROUP_SIZE_M": 4,
        "num_warps": 8,
        "num_stages": 2
      },
      "addmm_fp16": {
        "BLOCK_SIZE_M": 128,
        "BLOCK_SIZE_N": 64,
        "BLOCK_SIZE_K": 64,
        "GROUP_SIZE_M": 4,
        "num_warps": 8,
        "num_stages": 2
      },
      "addmm_fp16_out_fp32": {
        "BLOCK_SIZE_M": 128,
        "BLOCK_SIZE_N": 64,
        "BLOCK_SIZE_K": 64,
        "GROUP_SIZE_M": 4,
        "num_warps": 8,
        "num_stages": 2
      },
      "addmm_bf16_unaligned": {
        "BLOCK_SIZE_M": 128,
        "BLOCK_SIZE_N": 64,
        "BLOCK_SIZE_K": 64,
        "GROUP_SIZE_M": 4,
        "num_warps": 8,
        "num_stages": 2
      },
      "addmm_fp16_unaligned": {
        "BLOCK_SIZE_M": 128,
        "BLOCK_SIZE_N": 64,
        "BLOCK_SIZE_K": 64,
        "GROUP_SIZE_M": 4,
        "num_warps": 8,
        "num_stages": 2
      },
      "addmm_fp16_out_fp32_unaligned": {
        "BLOCK_SIZE_M": 128,
        "BLOCK_SIZE_N": 64,
        "BLOCK_SIZE_K": 64,
        "GROUP_SIZE_M": 4,
        "num_warps": 8,
        "num_stages": 2
      },
      "matmul_bf16": {
        "BLOCK_SIZE_M": 128,
        "BLOCK_SIZE_N": 64,
        "BLOCK_SIZE_K": 64,
        "GROUP_SIZE_M": 4,
        "num_warps": 8,
        "num_stages": 2
      },
      "matmul_bf16_out_fp32": {
        "BLOCK_SIZE_M": 128,
        "BLOCK_SIZE_N": 64,
        "BLOCK_SIZE_K": 64,
        "GROUP_SIZE_M": 4,
        "num_warps": 8,
        "num_stages": 2
      },
      "matmul_fp16": {
        "BLOCK_SIZE_M": 128,
        "BLOCK_SIZE_N": 64,
        "BLOCK_SIZE_K": 64,
        "GROUP_SIZE_M": 4,
        "num_warps": 8,
        "num_stages": 2
      },
      "matmul_fp16_out_fp32": {
        "BLOCK_SIZE_M": 128,
        "BLOCK_SIZE_N": 64,
        "BLOCK_SIZE_K": 64,
        "GROUP_SIZE_M": 4,
        "num_warps": 8,
        "num_stages": 2
      },
      "matmul_bf16_ta": {
        "BLOCK_SIZE_M": 128,
        "BLOCK_SIZE_N": 64,
        "BLOCK_SIZE_K": 64,
        "GROUP_SIZE_M": 4,
        "num_warps": 8,
        "num_stages": 2
      },
      "matmul_bf16_out_fp32_ta": {
        "BLOCK_SIZE_M": 128,
        "BLOCK_SIZE_N": 64,
        "BLOCK_SIZE_K": 64,
        "GROUP_SIZE_M": 4,
        "num_warps": 8,
        "num_stages": 2
      },
      "matmul_fp16_ta": {
        "BLOCK_SIZE_M": 128,
        "BLOCK_SIZE_N": 64,
        "BLOCK_SIZE_K": 64,
        "GROUP_SIZE_M": 4,
        "num_warps": 8,
        "num_stages": 2
      },
      "matmul_fp16_out_fp32_ta": {
        "BLOCK_SIZE_M": 128,
        "BLOCK_SIZE_N": 64,
        "BLOCK_SIZE_K": 64,
        "GROUP_SIZE_M": 4,
        "num_warps": 8,
        "num_stages": 2
      },
      "matmul_bf16_tb": {
        "BLOCK_SIZE_M": 128,
        "BLOCK_SIZE_N": 64,
        "BLOCK_SIZE_K": 64,
        "GROUP_SIZE_M": 4,
        "num_warps": 8,
        "num_stages": 2
      },
      "matmul_bf16_out_fp32_tb": {
        "BLOCK_SIZE_M": 128,
        "BLOCK_SIZE_N": 64,
        "BLOCK_SIZE_K": 64,
        "GROUP_SIZE_M": 4,
        "num_warps": 8,
        "num_stages": 2
      },
      "matmul_fp16_tb": {
        "BLOCK_SIZE_M": 128,
        "BLOCK_SIZE_N": 64,
        "BLOCK_SIZE_K": 64,
        "GROUP_SIZE_M": 4,
        "num_warps": 8,
        "num_stages": 2
      },
      "matmul_fp16_out_fp32_tb": {
        "BLOCK_SIZE_M": 128,
        "BLOCK_SIZE_N": 64,
        "BLOCK_SIZE_K": 64,
        "GROUP_SIZE_M": 4,
        "num_warps": 8,
        "num_stages": 2
      },
      "matmul_bf16_tab": {
        "BLOCK_SIZE_M": 128,
        "BLOCK_SIZE_N": 64,
        "BLOCK_SIZE_K": 64,
        "GROUP_SIZE_M": 4,
        "num_warps": 8,
        "num_stages": 2
      },
      "matmul_bf16_out_fp32_tab": {
        "BLOCK_SIZE_M": 128,
        "BLOCK_SIZE_N": 64,
        "BLOCK_SIZE_K": 64,
        "GROUP_SIZE_M": 4,
        "num_warps": 8,
        "num_stages": 2
      },
      "matmul_fp16_tab": {
        "BLOCK_SIZE_M": 128,
        "BLOCK_SIZE_N": 64,
        "BLOCK_SIZE_K": 64,
        "GROUP_SIZE_M": 4,
        "num_warps": 8,
        "num_stages": 2
      },
      "matmul_fp16_out_fp32_tab": {
        "BLOCK_SIZE_M": 128,
        "BLOCK_SIZE_N": 64,
        "BLOCK_SIZE_K": 64,
        "GROUP_SIZE_M": 4,
        "num_warps": 8,
        "num_stages": 2
      },
      "matmul_bf16_unaligned": {
        "BLOCK_SIZE_M": 64,
        "BLOCK_SIZE_N": 64,
        "BLOCK_SIZE_K": 64,
        "GROUP_SIZE_M": 6,
        "num_warps": 8,
        "num_stages": 2
      },
      "matmul_bf16_out_fp32_unaligned": {
        "BLOCK_SIZE_M": 64,
        "BLOCK_SIZE_N": 64,
        "BLOCK_SIZE_K": 64,
        "GROUP_SIZE_M": 6,
        "num_warps": 8,
        "num_stages": 2
      },
      "matmul_fp16_unaligned": {
        "BLOCK_SIZE_M": 64,
        "BLOCK_SIZE_N": 64,
        "BLOCK_SIZE_K": 64,
        "GROUP_SIZE_M": 6,
        "num_warps": 8,
        "num_stages": 2
      },
      "matmul_fp16_out_fp32_unaligned": {
        "BLOCK_SIZE_M": 64,
        "BLOCK_SIZE_N": 64,
        "BLOCK_SIZE_K": 64,
        "GROUP_SIZE_M": 6,
        "num_warps": 8,
        "num_stages": 2
      },
      "matmul_bf16_ta_unaligned": {
        "BLOCK_SIZE_M": 64,
        "BLOCK_SIZE_N": 64,
        "BLOCK_SIZE_K": 64,
        "GROUP_SIZE_M": 6,
        "num_warps": 8,
        "num_stages": 2
      },
      "matmul_bf16_out_fp32_ta_unaligned": {
        "BLOCK_SIZE_M": 64,
        "BLOCK_SIZE_N": 64,
        "BLOCK_SIZE_K": 64,
        "GROUP_SIZE_M": 6,
        "num_warps": 8,
        "num_stages": 2
      },
      "matmul_fp16_ta_unaligned": {
        "BLOCK_SIZE_M": 64,
        "BLOCK_SIZE_N": 64,
        "BLOCK_SIZE_K": 64,
        "GROUP_SIZE_M": 6,
        "num_warps": 8,
        "num_stages": 2
      },
      "matmul_fp16_out_fp32_ta_unaligned": {
        "BLOCK_SIZE_M": 64,
        "BLOCK_SIZE_N": 64,
        "BLOCK_SIZE_K": 64,
        "GROUP_SIZE_M": 6,
        "num_warps": 8,
        "num_stages": 2
      },
      "matmul_bf16_tb_unaligned": {
        "BLOCK_SIZE_M": 64,
        "BLOCK_SIZE_N": 64,
        "BLOCK_SIZE_K": 64,
        "GROUP_SIZE_M": 6,
        "num_warps": 8,
        "num_stages": 2
      },
      "matmul_bf16_out_fp32_tb_unaligned": {
        "BLOCK_SIZE_M": 64,
        "BLOCK_SIZE_N": 64,
        "BLOCK_SIZE_K": 64,
        "GROUP_SIZE_M": 6,
        "num_warps": 8,
        "num_stages": 2
      },
      "matmul_fp16_tb_unaligned": {
        "BLOCK_SIZE_M": 64,
        "BLOCK_SIZE_N": 64,
        "BLOCK_SIZE_K": 64,
        "GROUP_SIZE_M": 6,
        "num_warps": 8,
        "num_stages": 2
      },
      "matmul_fp16_out_fp32_tb_unaligned": {
        "BLOCK_SIZE_M": 64,
        "BLOCK_SIZE_N": 64,
        "BLOCK_SIZE_K": 64,
        "GROUP_SIZE_M": 6,
        "num_warps": 8,
        "num_stages": 2
      },
      "matmul_bf16_tab_unaligned": {
        "BLOCK_SIZE_M": 64,
        "BLOCK_SIZE_N": 64,
        "BLOCK_SIZE_K": 64,
        "GROUP_SIZE_M": 6,
        "num_warps": 8,
        "num_stages": 2
      },
      "matmul_bf16_out_fp32_tab_unaligned": {
        "BLOCK_SIZE_M": 64,
        "BLOCK_SIZE_N": 64,
        "BLOCK_SIZE_K": 64,
        "GROUP_SIZE_M": 6,
        "num_warps": 8,
        "num_stages": 2
      },
      "matmul_fp16_tab_unaligned": {
        "BLOCK_SIZE_M": 64,
        "BLOCK_SIZE_N": 64,
        "BLOCK_SIZE_K": 64,
        "GROUP_SIZE_M": 6,
        "num_warps": 8,
        "num_stages": 2
      },
      "matmul_fp16_out_fp32_tab_unaligned": {
        "BLOCK_SIZE_M": 64,
        "BLOCK_SIZE_N": 64,
        "BLOCK_SIZE_K": 64,
        "GROUP_SIZE_M": 6,
        "num_warps": 8,
        "num_stages": 2
      },
      "addmm_gelu_bf16": {
        "BLOCK_SIZE_M": 128,
        "BLOCK_SIZE_N": 64,
        "BLOCK_SIZE_K": 64,
        "GROUP_SIZE_M": 4,
        "num_warps": 8,
        "num_stages": 2
      },
      "addmm_gelu_fp16": {
        "BLOCK_SIZE_M": 128,
        "BLOCK_SIZE_N": 64,
        "BLOCK_SIZE_K": 64,
        "GROUP_SIZE_M": 4,
        "num_warps": 8,
        "num_stages": 2
      },
      "addmm_gelu_preact_bf16": {
        "BLOCK_SIZE_M": 128,
        "BLOCK_SIZE_N": 64,
        "BLOCK_SIZE_K": 64,
        "GROUP_SIZE_M": 4,
        "num_warps": 8,
        "num_stages": 2
      },
      "addmm_gelu_preact_fp16": {
        "BLOCK_SIZE_M": 128,
        "BLOCK_SIZE_N": 64,
        "BLOCK_SIZE_K": 64,
        "GROUP_SIZE_M": 4,
        "num_warps": 8,
        "num_stages": 2
      },
      "matmul_gelu_bf16": {
        "BLOCK_SIZE_M": 128,
        "BLOCK_SIZE_N": 64,
        "BLOCK_SIZE_K": 64,
        "GROUP_SIZE_M": 4,
        "num_warps": 8,
        "num_stages": 2
      },
      "matmul_gelu_fp16": {
        "BLOCK_SIZE_M": 128,
        "BLOCK_SIZE_N": 64,
        "BLOCK_SIZE_K": 64,
        "GROUP_SIZE_M": 4,
        "num_warps": 8,
        "num_stages": 2
      },
      "addmm_gelu_bf16_unaligned": {
        "BLOCK_SIZE_M": 128,
        "BLOCK_SIZE_N": 64,
        "BLOCK_SIZE_K": 64,
        "GROUP_SIZE_M": 4,
        "num_warps": 8,
        "num_stages": 2
      },
      "addmm_gelu_fp16_unaligned": {
        "BLOCK_SIZE_M": 128,
        "BLOCK_SIZE_N": 64,
        "BLOCK_SIZE_K": 64,
        "GROUP_SIZE_M": 4,
        "num_warps": 8,
        "num_stages": 2
      },
      "addmm_gelu_preact_bf16_unaligned": {
        "BLOCK_SIZE_M": 128,
        "BLOCK_SIZE_N": 64,
        "BLOCK_SIZE_K": 64,
        "GROUP_SIZE_M": 4,
        "num_warps": 8,
        "num_stages": 2
      },
      "addmm_gelu_preact_fp16_unaligned": {
        "BLOCK_SIZE_M": 128,
        "BLOCK_SIZE_N": 64,
        "BLOCK_SIZE_K": 64,
        "GROUP_SIZE_M": 4,
        "num_warps": 8,
        "num_stages": 2
      },
      "matmul_gelu_bf16_unaligned": {
        "BLOCK_SIZE_M": 64,
        "BLOCK_SIZE_N": 64,
        "BLOCK_SIZE_K": 64,
        "GROUP_SIZE_M": 6,
        "num_warps": 8,
        "num_stages": 2
      },
      "matmul_gelu_fp16_unaligned": {
        "BLOCK_SIZE_M": 64,
        "BLOCK_SIZE_N": 64,
        "BLOCK_SIZE_K": 64,
        "GROUP_SIZE_M": 6,
        "num_warps": 8,
        "num_stages": 2
      }
    }
  }
}